{
  "$schema": "https://json-schema.org/draft/2020-12/schema",
  "$id": "https://github.com/shinyaoguri/metaphor/contract/frame.schema.json",
  "title": "Probe frame.json",
  "description": "Producer (metaphor) が current/frame.json および sequence/frame.NNNN.json に書き出す単一フレームのメタデータ。Swift 型 ProbeFrameMetadata (Sources/MetaphorCore/Probe/ProbeFrameMetadata.swift) が正典。additive・前方互換を原則とし、キーのリネーム/削除/型変更は schemaVersion を上げる破壊的変更。",
  "type": "object",
  "additionalProperties": false,
  "required": ["schemaVersion", "id", "frame", "time", "size", "custom", "customTypes", "warnings"],
  "properties": {
    "schemaVersion": {
      "description": "スキーマバージョン。現行 = 4 (v2:stats / v3:customTypes / v4:sourceStamp)。bump は破壊的変更。",
      "const": 4
    },
    "id": {
      "description": "対応するリクエストの id を echo したもの。",
      "type": "string"
    },
    "label": {
      "description": "リクエストの任意ラベル。未指定時はキー自体が省略される。",
      "type": "string"
    },
    "sourceStamp": {
      "description": "ソース世代の刻印 (provenance)。consumer が METAPHOR_SOURCE_STAMP で注入し producer が echo する。未注入時はキー省略。v4 additive。",
      "type": "string"
    },
    "frame": {
      "description": "レンダリングされたフレーム番号。",
      "type": "integer"
    },
    "time": {
      "description": "スケッチ開始からの経過時間 (秒)。",
      "type": "number"
    },
    "size": {
      "description": "オフスクリーン解像度。",
      "type": "object",
      "additionalProperties": false,
      "required": ["width", "height"],
      "properties": {
        "width": { "type": "integer" },
        "height": { "type": "integer" }
      }
    },
    "custom": {
      "description": "probe(_:_:) で記録されたユーザー定義値。値の型は customTypes と対応する。ベクトルは裸の配列。",
      "type": "object"
    },
    "customTypes": {
      "description": "custom の各キー -> 型タグ。裸の配列であるベクトルとスカラー配列を区別するため v3 で追加。",
      "type": "object",
      "additionalProperties": {
        "enum": ["double", "int", "string", "bool", "vec2", "vec3", "vec4"]
      }
    },
    "warnings": {
      "description": "プラグインが検出した警告 (例: blank frame)。",
      "type": "array",
      "items": { "type": "string" }
    },
    "stats": {
      "description": "32x32 グリッドサンプルから 1 パスで計算する軽量画像統計。解析不能時 (テクスチャ読み出し失敗) はキー省略 (実装は encodeIfPresent。null 許容型は後方互換のため残す)。v2 additive。",
      "type": ["object", "null"],
      "additionalProperties": false,
      "required": ["meanColor", "meanLuminance", "contentFraction", "sampleGrid"],
      "properties": {
        "meanColor": {
          "description": "サンプル平均色 [r,g,b] (各 0..1、ガンマ符号化値)。",
          "type": "array",
          "items": { "type": "number", "minimum": 0, "maximum": 1 },
          "minItems": 3,
          "maxItems": 3
        },
        "meanLuminance": {
          "description": "サンプル平均輝度 (Rec.709 重み、0..1)。",
          "type": "number",
          "minimum": 0,
          "maximum": 1
        },
        "contentFraction": {
          "description": "背景色と十分異なるコンテンツサンプルの割合 (0..1)。",
          "type": "number",
          "minimum": 0,
          "maximum": 1
        },
        "contentBounds": {
          "description": "コンテンツの正規化バウンディングボックス。原点=左上、各成分 0..1 (この意味論=原点左上は description 止まりで強制されない)。コンテンツが無い (blank) 場合はキー省略 (実装は encodeIfPresent。null 許容型は後方互換のため残す)。",
          "type": ["object", "null"],
          "additionalProperties": false,
          "required": ["x", "y", "width", "height"],
          "properties": {
            "x": { "type": "number", "minimum": 0, "maximum": 1 },
            "y": { "type": "number", "minimum": 0, "maximum": 1 },
            "width": { "type": "number", "minimum": 0, "maximum": 1 },
            "height": { "type": "number", "minimum": 0, "maximum": 1 }
          }
        },
        "sampleGrid": {
          "description": "1 辺あたりのサンプル数 (= 32)。バウンディングボックスの粒度を示す。",
          "type": "integer"
        }
      }
    },
    "params": {
      "description": "このフレームを生んだ Parameter Store (契約点 7) の値スナップショット。1 回の snapshot で「画像 + それを生んだパラメータ」が揃うため、consumer は別ファイルの読み取りタイミングに賭けずに来歴を確定できる。@Param が 1 つも宣言されていないスケッチではキー省略。単一フレーム経路と連続キャプチャの両方に載る (メモリ内の読み取りのみで syscall が無いため)。失敗応答では省略。schemaVersion 4 のまま additive 追加 (Issue #424)。",
      "type": "object",
      "additionalProperties": false,
      "required": ["revision", "values"],
      "properties": {
        "revision": {
          "description": "ストアの revision (値が変わるたびに単調増加)。params.json の revision と同じ意味で、自分が書いた set-request が反映された後のフレームかを画像とセットで判定できる。",
          "type": "integer",
          "minimum": 0
        },
        "values": {
          "description": "パラメータ名 → 現在値 (型タグの無い裸の JSON。params.json の value と同じ表現)。型・レンジ・choices の正典は params.json 側で、ここは値のスナップショットに徹する。",
          "type": "object",
          "additionalProperties": {
            "type": ["number", "boolean", "string", "array"]
          }
        }
      }
    },
    "performance": {
      "description": "リクエスト処理時に採取する実測パフォーマンス統計。スケッチの「重さ」を AI が画像からの推測でなく数値で判断するためのシグナル。単一フレーム経路 (current/frame.json) のみで搭載され、連続キャプチャ (sequence/frame.NNNN.json)・失敗応答・採取不能時 (レンダラー未接続等) はキー省略。schemaVersion 4 のまま additive 追加 (Issue #271)。",
      "type": "object",
      "additionalProperties": false,
      "required": ["targetFPS", "thermalState"],
      "properties": {
        "fps": {
          "description": "直近約 1 秒の実測フレームレート。ウィンドウ内のフレームが 2 個未満 (noLoop 停止中・起動直後) はキー省略。",
          "type": "number",
          "minimum": 0
        },
        "targetFPS": {
          "description": "実効ターゲット FPS (frameRate() / METAPHOR_FPS 解決後の設定値)。",
          "type": "integer",
          "minimum": 1
        },
        "frameTimeMs": {
          "description": "直近約 1 秒のフレーム時間 (ミリ秒)。max はスパイク検出用。fps と同じ条件でキー省略。",
          "type": "object",
          "additionalProperties": false,
          "required": ["mean", "max"],
          "properties": {
            "mean": { "type": "number", "minimum": 0 },
            "max": { "type": "number", "minimum": 0 }
          }
        },
        "memoryMB": {
          "description": "自プロセスの phys_footprint (MB)。Activity Monitor の「メモリ」相当の実効フットプリント。取得失敗時はキー省略。",
          "type": "number",
          "minimum": 0
        },
        "cpuPercent": {
          "description": "前回 Probe リクエストから今回まで (初回はスケッチ起動から) の平均 CPU 使用率 (%)。1 コア = 100% (top 互換。マルチコア使用で 100 超あり)。取得失敗時はキー省略。",
          "type": "number",
          "minimum": 0
        },
        "thermalState": {
          "description": "ProcessInfo.thermalState の文字列表現。unknown は将来の未知ケース用。",
          "enum": ["nominal", "fair", "serious", "critical", "unknown"]
        }
      }
    }
  }
}
