{
  "schemaVersion" : 4,
  "id" : "01HXYZABCDEF0123456789",
  "label" : "baseline",
  "sourceStamp" : "build-abc123",
  "frame" : 42,
  "time" : 1.234,
  "size" : {
    "width" : 1280,
    "height" : 720
  },
  "custom" : {
    "particles.count" : 128,
    "camera.position" : [1.5, 2.0, 3.5],
    "phase" : "initialization",
    "enabled" : true,
    "momentum" : 0.95
  },
  "customTypes" : {
    "particles.count" : "int",
    "camera.position" : "vec3",
    "phase" : "string",
    "enabled" : "bool",
    "momentum" : "double"
  },
  "warnings" : [],
  "stats" : {
    "meanColor" : [0.5, 0.5, 0.5],
    "meanLuminance" : 0.5,
    "contentFraction" : 0.75,
    "contentBounds" : {
      "x" : 0.1,
      "y" : 0.2,
      "width" : 0.8,
      "height" : 0.6
    },
    "sampleGrid" : 32
  },
  "params" : {
    "revision" : 7,
    "values" : {
      "radius" : 120.0,
      "showGrid" : false,
      "tint" : [1, 1, 1, 1]
    }
  },
  "performance" : {
    "fps" : 59.8,
    "targetFPS" : 60,
    "frameTimeMs" : {
      "mean" : 16.7,
      "max" : 22.1
    },
    "memoryMB" : 412.3,
    "cpuPercent" : 87.5,
    "thermalState" : "nominal"
  }
}
